{
  "baseline": {
    "implementation_id": "AGD_full_GEMM_n1024",
    "kind": "native"
  },
  "candidate": {
    "implementation_id": "AGD_quotient_GEMM_pipeline_r64",
    "kind": "native"
  },
  "dimensions": {
    "matrix_rows": 512,
    "matrix_cols": 512,
    "d": 512,
    "r": 1024,
    "tile": 16,
    "nclasses": 8,
    "operation_count_baseline_per_step": 262144,
    "operation_count_candidate_per_step": 1024,
    "operation_count_ratio_theory": 256.0
  },
  "environment": {
    "python": "3.11",
    "arch": "aarch64"
  },
  "expected_observables": [
    "quotient forward exact (AGD projection)",
    "reconstruction exact (AGD section)",
    "invariant block-constancy exact",
    "direct wall-clock speedup > 1 reported",
    "operation count ratio reported separately"
  ],
  "invariant": {
    "definition": "tile-tile block constancy on every state (exact)",
    "function_name": "engines.linear_exact.omega_matrix"
  },
  "mathematical_object": {
    "state_space": "R^(n x n) AGD block-quotient sector Omega (diagonal q=(dD+rD)^2 projected exact)",
    "quotient_space": "R^r block representatives; AGD canonical quotient Tbar(q) = q * w(class)",
    "transition": "T(A)[ii][jj] = A[ii][jj] * w[class(bi,bj)]  (block-scale operator on the AGD structural sector)",
    "projection": "pi(A) = canonical single rep per tile-tile block (AGD projection theorem)",
    "reconstruction": "sigma(q) = tile-tile replicate to full n x n (AGD reconstruction closure)",
    "invariant": "tile-tile block constancy (exact; Lean4 AGDGemmProjection/Reconstruction lane)",
    "observable": "class representative matrix pi(A)"
  },
  "parameters": {
    "model": "matrix",
    "steps": 8,
    "tile": 16,
    "a": 3,
    "b": 1,
    "weights": [
      1.0,
      1.25,
      0.9,
      1.1,
      1.5,
      0.8,
      1.3,
      0.95
    ],
    "note": "silicon closure 2026-09-23 AGD GEMM gate: OVERALL=PASS (correctness 40/40, stability 8/8, quotient 6/6, dim 22/22, E2E 5/5, err=0); E2E 1.285-2.273x; 6.26x refuted (not present in receipts, i-j-k baseline artifact); this PCSS run measures the exact-block-quotient rewrite only"
  },
  "quotient": {
    "definition": "AGD block quotient: pi(T(A)) = Tbar(pi(A)) exact (intertwining; AGDGemmProjection.lean projection_iterate)",
    "function_name": "engines.quotient.run_quotient",
    "tolerance": 0.0,
    "relation": "exact"
  },
  "reconstruction": {
    "definition": "sigma(q) block-replicate (AGDGemmReconstruction.lean section_is_right_inverse / reconstruction_closure)",
    "function_name": "engines.reconstruction.run_reconstruction",
    "tolerance": 0.0,
    "metric": "max"
  },
  "repetitions": 30,
  "scenario_id": "agd-gemm-quotient-pipeline-2026-09-23",
  "schema": "PCSS-SCENARIO",
  "schema_version": "1.0",
  "seed": 20260923,
  "timing_source": "clock_gettime_monotonic",
  "warmup_policy": "fixed",
  "warmups": 5,
  "workload": {
    "kind": "exact_invariant_sector",
    "function_name": "engines.linear_exact.LinearExactMatrixModel",
    "model": "matrix"
  }
}
