{
  "baseline": {
    "implementation_id": "T_full_vector_d262144",
    "kind": "native"
  },
  "candidate": {
    "implementation_id": "Tbar_vector_r65536_sigma_reconstruct",
    "kind": "native"
  },
  "dimensions": {
    "d": 262144,
    "r": 65536,
    "tile": 4,
    "nclasses": 65536,
    "operation_count_baseline_per_step": 262144,
    "operation_count_candidate_per_step": 65536,
    "operation_count_ratio_theory": 4.0
  },
  "environment": {
    "python": "3.13.5",
    "arch": "aarch64",
    "c_evidence": "simd_v6_validation.c, simd_sweep_v3.c (GCC 14.2.0, -O3 -march=native)"
  },
  "expected_observables": [
    "quotient forward exact",
    "reconstruction exact",
    "invariant block-constancy exact",
    "direct speedup reported separately",
    "operation count ratio reported separately"
  ],
  "invariant": {
    "definition": "block-constancy: all tile coords within each block equal (exact for the invariant sector)",
    "function_name": "engines.linear_exact.omega_vector"
  },
  "mathematical_object": {
    "state_space": "R^d (d=262144), block-constant invariant sector Omega (packed 8x8 NEON/FMA microkernel regime)",
    "quotient_space": "R^r (r=65536), class representatives (packed-A/B block accumulation from simd_v6_validation.c)",
    "transition": "T(x)[i] = x[i] * w[class(i)]  (block-scale, block-constant preserving)",
    "projection": "pi(x) = [x[c*tile] for c in 0..r-1]  (first element per block)",
    "reconstruction": "sigma(q) = [q[c] for c for _ in range(tile)]  (repeat each rep tile times)",
    "invariant": "block-constancy: x[b*tile .. (b+1)*tile -1] are all equal",
    "observable": "class representative vector pi(x)"
  },
  "parameters": {
    "model": "vector",
    "steps": 16,
    "tile": 4,
    "nclasses": 65536,
    "weights": [
      1.0,
      1.25,
      0.9,
      1.1,
      1.5,
      0.8,
      1.3,
      0.95
    ],
    "note": "C-cluster silicon evidence (this device): simd_v6_validation.c PACKED_NEON_8x8 checksum-matched kernel-8x8 -> N=128 bit-exact (max_abs=0, checksum deterministic) 56.11x kernel / 22.67x end-to-end; N>=256 exactness gate FAIL (residual ~2e-4) so certified claim is bounded to the exact N=128 sector; simd_sweep_v3 bit-exact 7.2-15.5x"
  },
  "quotient": {
    "definition": "exact block-constant projection with pi(T(x)) = Tbar(pi(x)) on invariant sector",
    "function_name": "engines.quotient.run_quotient",
    "tolerance": 0.0,
    "relation": "exact"
  },
  "reconstruction": {
    "definition": "sigma(q) = tile-replicate each quotient coord back to d-dim full vector",
    "function_name": "engines.reconstruction.run_reconstruction",
    "tolerance": 0.0,
    "metric": "max"
  },
  "repetitions": 30,
  "scenario_id": "simd-v6-packed-8x8-exact-sector-2026-09-23",
  "schema": "PCSS-SCENARIO",
  "schema_version": "1.0",
  "seed": 20260923,
  "timing_source": "clock_gettime_monotonic",
  "warmup_policy": "fixed",
  "warmups": 5,
  "workload": {
    "kind": "exact_invariant_sector",
    "function_name": "engines.linear_exact.LinearExactModel"
  }
}
